Column1,name,image_url,url,review count,rating,snippet,neighborhood,latitude,longitude,category,type,keywords,Column22,Column32
0,21st Street Coffee And Tea,http://s3-media1.fl.yelpcdn.com/bphoto/l2XybXUHmdaHGhX9Ju8HZw/ms.jpg,http://www.yelp.com/biz/21st-street-coffee-and-tea-pittsburgh-2?utm_campaign=yelp_api&utm_medium=api_v2_business&utm_source=ERehee8c-xBF5R86JGKbYg,36,4,"The best espresso downtown by far.

This is my favorite espresso in the city. 21st is on point. They serve it with a small glass of sparkling water.

The...",Downtown,40.44131,-80.00121,Coffee,Food,best;espresso;downtown;favorite;espresso;city;21st;point;small;glass;water,Coffee,Food
1,A & B Doughnuts,,http://www.yelp.com/biz/a-and-b-doughnuts-homestead?utm_campaign=yelp_api&utm_medium=api_v2_business&utm_source=ERehee8c-xBF5R86JGKbYg,2,5,"Before I left Pittsburgh for Texas, my sister and I went on every single thing we had not done in Pittsburgh. The list was short but on the list was a...",Homestead,40.40867615,-79.90471649,Donuts,Food,sister;single;thing;list;short;list,Donuts,Food
2,Acacia,http://s3-media2.fl.yelpcdn.com/bphoto/yY7ESIgVEh7oPc-Qg06O3g/ms.jpg,http://www.yelp.com/biz/acacia-pittsburgh?utm_campaign=yelp_api&utm_medium=api_v2_business&utm_source=ERehee8c-xBF5R86JGKbYg,83,4.5,"I give 5 stars for their cocktails, the concept, and its contribution to Pittsburgh's ongoing culinary and libation revolution. 

There's an element of...",South Side,40.428219,-79.97583,Nightlife,Nightlife,stars;cocktails;concept;contribution;ongoing;culinary;libation;revolution;element,Nightlife,Nightlife
3,Aiello's Pizza,http://s3-media1.fl.yelpcdn.com/bphoto/nJ2hFjoVlItASy7XvB1Isw/ms.jpg,http://www.yelp.com/biz/aiellos-pizza-pittsburgh?utm_campaign=yelp_api&utm_medium=api_v2_business&utm_source=ERehee8c-xBF5R86JGKbYg,130,4,"Really awesome pizza. You can argue about the merits of other pizza shops, but the sauce on Aiello's is great, and I love the crust.

Bring cash, get take...",Squirrel Hill,40.4332619,-79.9232407,Pizza,Food,awesome;pizza;merits;other;pizza;shops;sauce;great;crust;cash,Pizza,Food
4,All India,http://s3-media4.fl.yelpcdn.com/bphoto/sNQxbobk6466drV-Icb4YA/ms.jpg,http://www.yelp.com/biz/all-india-pittsburgh?utm_campaign=yelp_api&utm_medium=api_v2_business&utm_source=ERehee8c-xBF5R86JGKbYg,73,4,All India was quite the experience! My chalice glass was constantly full of water and the atmosphere was amazing! With Indian dance videos playing in the...,Oakland,40.4521894,-79.9525714,Indpak,Food,experience;chalice;glass;full;water;atmosphere;amazing;indian;dance;videos,Indpak,Food
5,Alla Famiglia,http://s3-media3.fl.yelpcdn.com/bphoto/63ZjoYaiX_Fg9NiqDDzN9Q/ms.jpg,http://www.yelp.com/biz/alla-famiglia-pittsburgh?utm_campaign=yelp_api&utm_medium=api_v2_business&utm_source=ERehee8c-xBF5R86JGKbYg,106,4.5,"Our experience last night at Alla Famiglia for Alicia's, my fiance's birthday, has changed my view of restaurants, food, service and ambiance in this...",Allentown,40.4216118,-79.9934616,Italian,Food,experience;last;night;fiance;birthday;view;restaurants;food;service;ambiance,Italian,Food
6,Allegheny Coffee & Tea Exchange,http://s3-media1.fl.yelpcdn.com/bphoto/BriYfBWkU8OC8VMoYSGLkA/ms.jpg,http://www.yelp.com/biz/allegheny-coffee-and-tea-exchange-pittsburgh?utm_campaign=yelp_api&utm_medium=api_v2_business&utm_source=ERehee8c-xBF5R86JGKbYg,35,4,"Not only does the coffee taste great, it's not overpriced, and the employees are always friendly. 

No matter how full I am after visiting one of the great...",Strip District,40.4513403,-79.9838608,Coffee,Food,coffee;taste;great;employees;friendly;full;great,Coffee,Food
7,Allegheny Sandwich Shoppe,http://s3-media2.fl.yelpcdn.com/bphoto/ssLPWZJroyAo5TTh1-FdBw/ms.jpg,http://www.yelp.com/biz/allegheny-sandwich-shoppe-pittsburgh?utm_campaign=yelp_api&utm_medium=api_v2_business&utm_source=ERehee8c-xBF5R86JGKbYg,19,4,"One of the best diners around--great traditional breakfast and lunch dishes, and a homey, comfortable atmosphere (and neat as a pin and super clean and...",North Side,40.4523081,-80.0150592,Sandwiches,Food,best;diners;great;traditional;breakfast;lunch;dishes;homey;comfortable;atmosphere;neat;pin;clean,Sandwiches,Food
8,Allegro Hearth Bakery,http://s3-media4.fl.yelpcdn.com/bphoto/j1rnxRs4yWbl0sijAEq7DQ/ms.jpg,http://www.yelp.com/biz/allegro-hearth-bakery-pittsburgh?utm_campaign=yelp_api&utm_medium=api_v2_business&utm_source=ERehee8c-xBF5R86JGKbYg,52,4.5,"We have a weekly ongoing order sourdough pick up and it's awesome but you know what's not so awesome after the initial awesomeness wears off?

Their fucking...",Squirrel Hill,40.43384215,-79.92308241,Bakeries,Food,weekly;ongoing;order;sourdough;awesome;awesome;initial;awesomeness,Bakeries,Food
9,Altius,http://s3-media1.fl.yelpcdn.com/bphoto/dUnH5M4rxTn6KMBUnj8kfA/ms.jpg,http://www.yelp.com/biz/altius-pittsburgh?utm_campaign=yelp_api&utm_medium=api_v2_business&utm_source=ERehee8c-xBF5R86JGKbYg,162,4.5,"After 3 failed attempts (due to weather), we finally succeeded! Yay, us! This was my last week in Pittsburgh for work so we decided this was a must do...",Duquesne Heights,40.438556,-80.019299,Newamerican,Food,attempts;weather;last;week;work,Newamerican,Food
10,Amazing Cafe,http://s3-media1.fl.yelpcdn.com/bphoto/MRs4DuFdoUOT3i9myDVjjw/ms.jpg,http://www.yelp.com/biz/amazing-cafe-pittsburgh?utm_campaign=yelp_api&utm_medium=api_v2_business&utm_source=ERehee8c-xBF5R86JGKbYg,53,5,"The Amazing Cafe is a completely organic restaurant located in the 1500 block of East Carson St. The place is small but nicely arranged.

Since my visit was...",South Side,40.42868,-79.98312,Cafes,Food,organic;restaurant;block;place;small;visit,Cafes,Food
11,Amazing Wok,http://s3-media2.fl.yelpcdn.com/bphoto/GVj2oLVvfiQAXaBJWkWC8g/ms.jpg,http://www.yelp.com/biz/amazing-wok-pittsburgh?utm_campaign=yelp_api&utm_medium=api_v2_business&utm_source=ERehee8c-xBF5R86JGKbYg,32,4,"In the Dormont area, Amazing Wok is the best for quick, affordable and tasty Chinese takeout/delivery. This is not a dine-in restaurant. The food has always...",Dormont,40.39469942,-80.03484249,Chinese,Food,area;best;quick;affordable;tasty;chinese;takeout;delivery;dine;restaurant;food,Chinese,Food
12,Andy's Sushi Bar,http://s3-media1.fl.yelpcdn.com/bphoto/IrcDz-3gvhSRh_EbcTBBDQ/ms.jpg,http://www.yelp.com/biz/andys-sushi-bar-pittsburgh?utm_campaign=yelp_api&utm_medium=api_v2_business&utm_source=ERehee8c-xBF5R86JGKbYg,44,4,Andy is great and his sushi is even better!  I've worked in the strip now for 12 years and have been going here ever since it all started.  The food is...,Strip District,40.45011139,-79.98587799,Sushi,Food,great;sushi;better;strip;years;food,Sushi,Food
13,Angkor Restaurant,http://s3-media1.fl.yelpcdn.com/bphoto/wEHB3qriOaw1y7Bge8p8jg/ms.jpg,http://www.yelp.com/biz/angkor-restaurant-pittsburgh?utm_campaign=yelp_api&utm_medium=api_v2_business&utm_source=ERehee8c-xBF5R86JGKbYg,59,4,This is an excellent Thai/Cambodian restaurant. The first night they let me sample the green curry sauce and the Panang sauce. I ended up trying a Cambodian...,West End,40.42744064,-80.05576324,Thai,Food,excellent;cambodian;restaurant;first;night;curry;sauce;sauce,Thai,Food
14,Apsara Cafe,http://s3-media4.fl.yelpcdn.com/bphoto/8gIMKpjd2OvHsBpCyzBDRw/ms.jpg,http://www.yelp.com/biz/apsara-cafe-pittsburgh?utm_campaign=yelp_api&utm_medium=api_v2_business&utm_source=ERehee8c-xBF5R86JGKbYg,47,4,I have been wanting to eat here for a while and I finally did this week. My boyfriend and I are big fans of Thai food and like trying different places. We...,South Side,40.42896883,-79.9817369,Thai,Food,while;week;boyfriend;big;fans;food;different;places,Thai,Food
16,Arcade Bakery & Cafe,http://s3-media4.fl.yelpcdn.com/bphoto/Y2txohyH10ioBuoMXBzGhA/ms.jpg,http://www.yelp.com/biz/arcade-bakery-and-cafe-pittsburgh?utm_campaign=yelp_api&utm_medium=api_v2_business&utm_source=ERehee8c-xBF5R86JGKbYg,6,4.5,"On many levels, I consider myself a Macy's devotee.  Every day is a One-Day sale and my Macy's card gives me access to coupons that keep me surrounded in...",Downtown,40.4395294,-79.9983673,Cafes,Food,many;levels;devotee;day;day;sale;card;access;coupons,Cafes,Food
17,Arcade Comedy Theater,http://s3-media4.fl.yelpcdn.com/bphoto/olP9dLZc6HyBoDjaRKuiEw/ms.jpg,http://www.yelp.com/biz/arcade-comedy-theater-pittsburgh?utm_campaign=yelp_api&utm_medium=api_v2_business&utm_source=ERehee8c-xBF5R86JGKbYg,21,4.5,"This place is awesome. Terrific. Fun!!!!
There are shows for kids, shows for adults, shows for adults-only, shows for families.
The Arcade hosts many types...",Downtown,40.443036,-79.998621,Arts,Arts,place;awesome;terrific;shows;kids;adults;adults;families;many;types,Arts,Arts
18,Arnold's Tea,http://s3-media2.fl.yelpcdn.com/bphoto/Pee92I4pJNTV1qrgJSCxYQ/ms.jpg,http://www.yelp.com/biz/arnolds-tea-pittsburgh?utm_campaign=yelp_api&utm_medium=api_v2_business&utm_source=ERehee8c-xBF5R86JGKbYg,21,4.5,I decided to check this place out since it has been a while since I've been on the North-side. There is street parking along with a parking lot on a...,North Side,40.453701,-80.000473,Coffee,Food,place;while;north;side;street;parking;parking;lot,Coffee,Food
21,Avenue B,http://s3-media2.fl.yelpcdn.com/bphoto/2ar8oH9VZBeYq03Q2GSsAg/ms.jpg,http://www.yelp.com/biz/avenue-b-pittsburgh?utm_campaign=yelp_api&utm_medium=api_v2_business&utm_source=ERehee8c-xBF5R86JGKbYg,164,4,"Really excellent meal, easily the best I had in my visit to Pittsburgh.

BYOB is such a fun concept, and loved that we got to pick out our own wine. Upon...",Friendship,40.45685577,-79.93643188,Newamerican,Food,excellent;meal;best;visit;byob;fun;concept;own;wine,Newamerican,Food
22,Bangal Kabab House and Restaurant,http://s3-media2.fl.yelpcdn.com/bphoto/9162H56suabPTtMCiU8dJQ/ms.jpg,http://www.yelp.com/biz/bangal-kabab-house-and-restaurant-pittsburgh?utm_campaign=yelp_api&utm_medium=api_v2_business&utm_source=ERehee8c-xBF5R86JGKbYg,87,4.5,"I have only ever been here for the lunch buffet, but I have out of the five other lunch buffets I have tried so far in Pittsburgh, this one is by far my...",Oakland,40.439047,-79.9554689,Indpak,Food,lunch;buffet;other;lunch;buffets;one,Indpak,Food
23,Bar 11,http://s3-media2.fl.yelpcdn.com/bphoto/34w7n_o6Dvrr5ncZcr7iZQ/ms.jpg,http://www.yelp.com/biz/bar-11-pittsburgh?utm_campaign=yelp_api&utm_medium=api_v2_business&utm_source=ERehee8c-xBF5R86JGKbYg,43,4,"Some people call this a frat house, maybe if a frat house is run by a couple of 50 year old guys, but dont get me wrong its a fun place.  

You order a...",South Side,40.42720445,-79.98731442,Nightlife,Nightlife,people;frat;house;frat;house;couple;year;old;guys;wrong;fun;place,Nightlife,Nightlife
24,Bar Marco,http://s3-media1.fl.yelpcdn.com/bphoto/4tnCnEWOw5GxNKPpw9AMAw/ms.jpg,http://www.yelp.com/biz/bar-marco-pittsburgh?utm_campaign=yelp_api&utm_medium=api_v2_business&utm_source=ERehee8c-xBF5R86JGKbYg,172,4,My daughter and I were trying to decide where to eat dinner last night. She went to the Pittsburgh Magazine website and looked at their list. She picked out...,Strip District,40.45249176,-79.98155975,Cafes,Food,daughter;dinner;last;night;website;list,Cafes,Food
25,Bartram House Bakery,http://s3-media3.fl.yelpcdn.com/bphoto/0zKSQ8zhY5qB8PllDoI9Zw/ms.jpg,http://www.yelp.com/biz/bartram-house-bakery-pittsburgh?utm_campaign=yelp_api&utm_medium=api_v2_business&utm_source=ERehee8c-xBF5R86JGKbYg,28,4,"Everything about this place  - food, service, atmosphere was A+ I had the filet mignon sandwich, and it was delicious! The bread was soft and fresh, and the...",South Side,40.42731442,-79.96800654,Cafes,Food,place;food;service;atmosphere;a+;sandwich;delicious;bread;soft;fresh,Cafes,Food
26,Bea Taco Town,http://s3-media1.fl.yelpcdn.com/bphoto/WC6FDqzlYU7tGL_eSO_bcA/ms.jpg,http://www.yelp.com/biz/bea-taco-town-pittsburgh?utm_campaign=yelp_api&utm_medium=api_v2_business&utm_source=ERehee8c-xBF5R86JGKbYg,40,4.5,I went today for the first time.  I ordered a taco salad with chorizo. I don't think it is an exaggeration to say that it was the best taco salad I've ever...,Downtown,40.442413,-79.997314,Mexican,Food,today;first;time;taco;salad;exaggeration;best;taco;salad,Mexican,Food
27,Bella Christie's & Lil Z's Sweet Boutique,http://s3-media3.fl.yelpcdn.com/bphoto/jMXgIxUPXmvEKZAVgWBWTg/ms.jpg,http://www.yelp.com/biz/bella-christies-and-lil-zs-sweet-boutique-pittsburgh?utm_campaign=yelp_api&utm_medium=api_v2_business&utm_source=ERehee8c-xBF5R86JGKbYg,21,4,"This shop and their staff are AMAZING!  I'm based in NY and wanted to send a dozen donuts to a client located in Pittsburgh.  

Dimitri was super helpful in...",Lawrenceville,40.464398,-79.966333,Donuts,Food,shop;staff;amazing;dozen;donuts;client;helpful,Donuts,Food
28,Better-Maid Donut,http://s3-media4.fl.yelpcdn.com/bphoto/kosx3Bm4nHjz_jxtnqfuXw/ms.jpg,http://www.yelp.com/biz/better-maid-donut-pittsburgh?utm_campaign=yelp_api&utm_medium=api_v2_business&utm_source=ERehee8c-xBF5R86JGKbYg,24,4.5,"Please please please come back soon!  A few months ago a van actually drove THROUGH the store front.  No one killed, but some injuries.  We miss the donuts...",Crafton Heights,40.44177628,-80.04746246,Donuts,Food,few;months;van;store;front;one;injuries;donuts,Donuts,Food
29,Bicycle Heaven,http://s3-media4.fl.yelpcdn.com/bphoto/UQDRen4KQxm4_kM68VL0Ew/ms.jpg,http://www.yelp.com/biz/bicycle-heaven-pittsburgh?utm_campaign=yelp_api&utm_medium=api_v2_business&utm_source=ERehee8c-xBF5R86JGKbYg,35,5,This was one of the highlights of my day in Pittsburgh. It is almost overwhelming to see everything in there.  One of my favorite sections was all the...,North Side,40.45637987,-80.03223081,Shopping,Shopping,highlights;day;overwhelming;favorite;sections,Shopping,Shopping
32,Big Dog Coffee,http://s3-media2.fl.yelpcdn.com/bphoto/cXbJ8NqeVBCnpnvhMksI0A/ms.jpg,http://www.yelp.com/biz/big-dog-coffee-pittsburgh?utm_campaign=yelp_api&utm_medium=api_v2_business&utm_source=ERehee8c-xBF5R86JGKbYg,153,4.5,"Y'all. I LIVED here when I lived on E. Carson. 
LIVED. 

Its the cutiest-patootiest coffee joint in the area. And now that I've been adulting and...",South Side,40.426003,-79.966652,Coffee,Food,patootiest;coffee;joint;area,Coffee,Food
33,Big Shot Bob's House of Wings,http://s3-media1.fl.yelpcdn.com/bphoto/X3ET7iAbYhTEv9OIhDrQng/ms.jpg,http://www.yelp.com/biz/big-shot-bobs-house-of-wings-pittsburgh?utm_campaign=yelp_api&utm_medium=api_v2_business&utm_source=ERehee8c-xBF5R86JGKbYg,43,4.5,"Pittsburgh just hasn't been that great to me for the year or so I've been here. Unless you are willing to visit the Strip and the like, you are stuck with...",Bellevue,40.50378285,-80.06156333,Sandwiches,Food,great;year;willing;like,Sandwiches,Food
34,Bigham Tavern,http://s3-media1.fl.yelpcdn.com/bphoto/vCYAb_GgIQ-P_fnKWynOEg/ms.jpg,http://www.yelp.com/biz/bigham-tavern-pittsburgh?utm_campaign=yelp_api&utm_medium=api_v2_business&utm_source=ERehee8c-xBF5R86JGKbYg,106,4,"Bruh!

The food here is so good! Being that I love bacon this is a place after my own heart. I had previously studied the pictures and reviews on Yelp and...",Mt. Washington,40.432386,-80.015066,Nightlife,Nightlife,food;good;bacon;place;own;heart;pictures;reviews,Nightlife,Nightlife
35,Bistro To Go,http://s3-media2.fl.yelpcdn.com/bphoto/TdHYGlGiUGaMvNo3bU0IXQ/ms.jpg,http://www.yelp.com/biz/bistro-to-go-pittsburgh?utm_campaign=yelp_api&utm_medium=api_v2_business&utm_source=ERehee8c-xBF5R86JGKbYg,33,4,"I ordered the stuffed chicken, roast beef, and garlic mashed potatoes for my mothers 80th birthday party.  The service was not only efficient and friendly,...",North Side,40.453289,-80.001091,Sandwiches,Food,chicken;roast;beef;garlic;potatoes;mothers;80th;birthday;party;service;efficient;friendly,Sandwiches,Food
36,Black Forge Coffee,http://s3-media4.fl.yelpcdn.com/bphoto/tHlAaNvr5ZEjPNcVjQV3gg/ms.jpg,http://www.yelp.com/biz/black-forge-coffee-pittsburgh?utm_campaign=yelp_api&utm_medium=api_v2_business&utm_source=ERehee8c-xBF5R86JGKbYg,11,5,The world is run on small business and Arlington Ave is becoming a small business empire.  Black Forge Coffee is run by Nick and Ashley and has home grown...,Allentown,40.42151642,-79.99243164,Coffee,Food,world;small;business;small;business;empire;home;grown,Coffee,Food
37,Blighty,,http://www.yelp.com/biz/blighty-pittsburgh?utm_campaign=yelp_api&utm_medium=api_v2_business&utm_source=ERehee8c-xBF5R86JGKbYg,1,4,British fare in the 'burgh? A variety of pastys (either fresh or frozen) and grocery items too. The traditional Cornish Pastie was tremendously flavorful...,Strip District,40.4503288,-79.9867935,Ethnic Markets,Food,british;fare;burgh;variety;pastys;fresh;frozen;grocery;items;traditional;flavorful,Ethnic Markets,Food
38,Blue Moon,http://s3-media4.fl.yelpcdn.com/bphoto/vLISPmE1aRKzslQOVkPMDA/ms.jpg,http://www.yelp.com/biz/blue-moon-pittsburgh?utm_campaign=yelp_api&utm_medium=api_v2_business&utm_source=ERehee8c-xBF5R86JGKbYg,23,4,"Fun fun times.

Visiting the Pittsburgh area for a quick weekend getaway for football. We love drag so we were found this spot online what an amazing dive...",Lawrenceville,40.4788799,-79.95566,Nightlife,Nightlife,fun;fun;times;area;quick;weekend;getaway;football;drag;spot;amazing;dive,Nightlife,Nightlife
39,Bluebird Kitchen,http://s3-media4.fl.yelpcdn.com/bphoto/6SGBam9l9nsrebEmS2sM1g/ms.jpg,http://www.yelp.com/biz/bluebird-kitchen-pittsburgh?utm_campaign=yelp_api&utm_medium=api_v2_business&utm_source=ERehee8c-xBF5R86JGKbYg,147,4,"I once asked myself, ""Where do all the young professionals of this fine rust belt city wait in line for fancy carry out lunches?"" 

The answer is Bluebird....",Downtown,40.44046395,-80.00173934,Newamerican,Food,young;professionals;fine;rust;belt;city;line;fancy;lunches;answer,Newamerican,Food
40,Bombay Gyro's and Lunch Box,http://s3-media1.fl.yelpcdn.com/bphoto/1CCh_WqhMj0hGQz8dmGvJA/ms.jpg,http://www.yelp.com/biz/bombay-gyros-and-lunch-box-pittsburgh?utm_campaign=yelp_api&utm_medium=api_v2_business&utm_source=ERehee8c-xBF5R86JGKbYg,16,4,"Cheap, quick and easy is just how I like my curry. The aloo baingan, or as I call it the 'eggplant potato-y thing,' is my hands down favorite dish when they...",Downtown,40.4442059,-79.9955278,Ethnic Markets,Food,cheap;quick;easy;curry;aloo;baingan;eggplant;potato;thing;hands;favorite;dish,Ethnic Markets,Food
41,BreadWorks,http://s3-media3.fl.yelpcdn.com/bphoto/CDDUjmq73tGEOdXbIONYUg/ms.jpg,http://www.yelp.com/biz/breadworks-pittsburgh?utm_campaign=yelp_api&utm_medium=api_v2_business&utm_source=ERehee8c-xBF5R86JGKbYg,17,4.5,"Why have I not been getting bread from BreadWorks my entire life?  I have never actually been inside BreadWorks, but tons of Pittsburgh restaurants use...",North Side,40.46213531,-80.01896667,Bakeries,Food,bread;entire;life;tons;restaurants;use,Bakeries,Food
42,Brew On Broadway,http://s3-media3.fl.yelpcdn.com/bphoto/09y3Fojq6DnqLsp6O7AgVg/ms.jpg,http://www.yelp.com/biz/brew-on-broadway-pittsburgh-2?utm_campaign=yelp_api&utm_medium=api_v2_business&utm_source=ERehee8c-xBF5R86JGKbYg,16,4.5,"My favorite coffee shop. I used to drive to Southside to Beehive but this is so close to home and so cozy that I can't stay away. 

The staff is so friendly...",Beechview,40.4108593,-80.0244004,Coffee,Food,favorite;coffee;shop;close;home;cozy;staff;friendly,Coffee,Food
43,Butcher and the Rye,http://s3-media4.fl.yelpcdn.com/bphoto/KD5gNk38_7OjzKjR76gUfQ/ms.jpg,http://www.yelp.com/biz/butcher-and-the-rye-pittsburgh?utm_campaign=yelp_api&utm_medium=api_v2_business&utm_source=ERehee8c-xBF5R86JGKbYg,354,4.5,"My go to restaurant every year for my birthday... 
It is my favorite restaurant in the city of Pittsburgh! Whenever I go- I HAVE to get the tartare. It is...",Downtown,40.442334,-80.002066,Newamerican,Food,go;restaurant;year;birthday;favorite;restaurant;city;tartare,Newamerican,Food
44,Butterjoint,http://s3-media1.fl.yelpcdn.com/bphoto/VHG9IiSD5cIuxZNahY0XtA/ms.jpg,http://www.yelp.com/biz/butterjoint-pittsburgh-3?utm_campaign=yelp_api&utm_medium=api_v2_business&utm_source=ERehee8c-xBF5R86JGKbYg,119,4,"holy sweet buttered heaven! the food is brilliantly well thought out. it's approachable and sophisticated.
beef tartare small plate is perfect. the plate...",Oakland,40.44997597,-79.95073719,Nightlife,Nightlife,food;well;approachable;sophisticated;beef;small;plate;perfect;plate,Nightlife,Nightlife
45,Cafe Delhi,http://s3-media4.fl.yelpcdn.com/bphoto/hzv7lf4MzV8dudN3QFgXVg/ms.jpg,http://www.yelp.com/biz/cafe-delhi-carnegie?utm_campaign=yelp_api&utm_medium=api_v2_business&utm_source=ERehee8c-xBF5R86JGKbYg,74,4,"Delicious, authentic Indian food and a friendly wait staff.

It can be crowded at lunch time but isn't that one of the ways to gauge how good the food...",Carnegie,40.40804317,-80.08732259,Indpak,Food,authentic;indian;food;friendly;wait;staff;lunch;time;ways;good;food,Indpak,Food
47,Cafe Moulin,http://s3-media2.fl.yelpcdn.com/bphoto/oFNLYEqsbdYnptRHAXWfZA/ms.jpg,http://www.yelp.com/biz/cafe-moulin-pittsburgh?utm_campaign=yelp_api&utm_medium=api_v2_business&utm_source=ERehee8c-xBF5R86JGKbYg,73,4,Cafe Moulin makes me smile. They are doing classic French crepes right! The menu has an extensive list of both sweet and savory crepes. The ingredients are...,Shadyside,40.45162224,-79.93318538,French,Food,smile;classic;french;crepes;menu;extensive;list;sweet;savory;crepes;ingredients,French,Food
48,Caliban Book Shop,http://s3-media2.fl.yelpcdn.com/bphoto/DZpKsjfaF6bSol5FfTCsTA/ms.jpg,http://www.yelp.com/biz/caliban-book-shop-pittsburgh?utm_campaign=yelp_api&utm_medium=api_v2_business&utm_source=ERehee8c-xBF5R86JGKbYg,24,4.5,"One of my favorite book shops ever. Has this amazing scent of old books - gosh, I could get high off of the aroma here (don't judge). Also, awesome staff...",Oakland,40.44491,-79.949,Shopping,Shopping,favorite;book;shops;amazing;scent;old;books;high;aroma;awesome;staff,Shopping,Shopping
49,California Cycle Path Indoor Cycling Studio,http://s3-media1.fl.yelpcdn.com/bphoto/Uv84vrHes8vYSxFie83Liw/ms.jpg,http://www.yelp.com/biz/california-cycle-path-indoor-cycling-studio-pittsburgh?utm_campaign=yelp_api&utm_medium=api_v2_business&utm_source=ERehee8c-xBF5R86JGKbYg,11,5,I love this place. The instructors make everyone feel confortable.  The workouts are scheduled during convenvient hours. Most classes are available...,Brighton Heights,40.48120938,-80.04149772,Active,Active,place;instructors;confortable;workouts;convenvient;hours;most;classes;available,Active,Active
50,Carnegie Museum of Natural History,http://s3-media4.fl.yelpcdn.com/bphoto/jdIu_tJKV-Fo6ZbwQbnWeA/ms.jpg,http://www.yelp.com/biz/carnegie-museum-of-natural-history-pittsburgh?utm_campaign=yelp_api&utm_medium=api_v2_business&utm_source=ERehee8c-xBF5R86JGKbYg,62,4.5,"Wow! This place was breath taking! 

My boyfriend's work had a 1920's themed event here and it was perfect! 
The architecture was beautiful, so detailed,...",Oakland,40.443424,-79.948845,Arts,Arts,place;breath;boyfriend;work;event;perfect;architecture;beautiful;detailed,Arts,Arts
51,Carnegie Museums of Pittsburgh,http://s3-media4.fl.yelpcdn.com/bphoto/lswQlnZjL0I3O236yhf4Bg/ms.jpg,http://www.yelp.com/biz/carnegie-museums-of-pittsburgh-pittsburgh?utm_campaign=yelp_api&utm_medium=api_v2_business&utm_source=ERehee8c-xBF5R86JGKbYg,49,4.5,This museum is awesome. There's two parts of it: the natural history museum and the art museum. The price of admission gives you access to both so come...,Oakland,40.444011,-79.950361,Arts,Arts,museum;awesome;parts;natural;history;museum;art;museum;price;admission;access,Arts,Arts
52,Carson Street Deli & Craft Beer Bar,http://s3-media4.fl.yelpcdn.com/bphoto/4jxyWyzDCStMPg3d1__hog/ms.jpg,http://www.yelp.com/biz/carson-street-deli-and-craft-beer-bar-pittsburgh?utm_campaign=yelp_api&utm_medium=api_v2_business&utm_source=ERehee8c-xBF5R86JGKbYg,79,4.5,My son has been after me for some time to go here so I took his advice and went. This place is remarkable! Upon entering there is a small bar area along...,South Side,40.42893,-79.98308,Sandwiches,Food,son;time;advice;place;remarkable;small;bar;area,Sandwiches,Food
53,Casa Rasta,http://s3-media2.fl.yelpcdn.com/bphoto/TRs8QITIVcpg3LWJ9HhQhw/ms.jpg,http://www.yelp.com/biz/casa-rasta-pittsburgh-2?utm_campaign=yelp_api&utm_medium=api_v2_business&utm_source=ERehee8c-xBF5R86JGKbYg,104,3.5,"(note - they are NOT closed as Yelp is indicating... this is incorrect )

They joined forces with the Berumen family aka Las Palmas ...
Word on the street...",Beechview,40.4052704,-80.0302382,Mexican,Food,yelp;incorrect;forces;family;word;street,Mexican,Food
54,Casa Reyna,http://s3-media4.fl.yelpcdn.com/bphoto/jQ4Q_FfuvtYfUesHCczOiA/ms.jpg,http://www.yelp.com/biz/casa-reyna-pittsburgh?utm_campaign=yelp_api&utm_medium=api_v2_business&utm_source=ERehee8c-xBF5R86JGKbYg,133,3.5,"I love Mexican food, I have eaten at so many establishments I could not remember them if I tried... but this place- This place will go down in my...",Strip District,40.4516855,-79.9833236,Mexican,Food,mexican;food;many;establishments;place-;place,Mexican,Food
55,Cathedral of Learning,http://s3-media3.fl.yelpcdn.com/bphoto/2wu66dY3aAOBmoHA2BEnfg/ms.jpg,http://www.yelp.com/biz/cathedral-of-learning-pittsburgh?utm_campaign=yelp_api&utm_medium=api_v2_business&utm_source=ERehee8c-xBF5R86JGKbYg,69,4.5,"If you are looking for something educational and impressive, I highly recommend going to The Nationality Rooms at The Cathedral of Learning. It is only $4...",Oakland,40.44419679,-79.95344545,Arts,Arts,educational;impressive,Arts,Arts
